item_id,name,description,special_handling_instructions,dimensions_cm,unit_weight_kg,category,is_fragile,is_hazardous,reorder_point,economic_order_quantity,supplier_id,manufacturing_cost_per_unit
PROD-00434,Optimized dynamic project,Suscipit non exercitationem sint. Soluta sapiente cum ea architecto.,Standard handling.,63x77x25,105.8,Hardware,False,False,227,746,SUP-010,4154.49
PROD-00435,Networked mobile strategy,Consequuntur officia nulla fugit nisi dignissimos nam. Explicabo quas cupiditate dicta quasi consectetur. Consectetur culpa aperiam temporibus nemo nihil.,Standard handling.,52x14x34,58.86,Electronics,False,False,459,885,SUP-007,2878.38
PROD-00436,Profit-focused systemic architecture,Similique dicta assumenda consequatur doloribus reiciendis.,"None, Hazardous material, consult safety data sheet.",97x68x9,22.36,Hardware,False,True,118,763,SUP-017,3718.57
PROD-00437,Re-contextualized national knowledgebase,Quaerat in facilis ea reiciendis vitae voluptatum. Iusto quisquam iure esse ab corrupti repellat.,Standard handling.,85x73x6,153.72,Hardware,False,False,64,201,SUP-019,3537.32
PROD-00438,Universal exuding throughput,Pariatur ex quo provident earum aliquam voluptatum. Ipsam voluptas maxime dolorem. Aliquam blanditiis magnam suscipit animi fuga.,Standard handling.,62x60x23,36.22,Medical Supplies,False,False,239,436,SUP-011,332.49
PROD-00439,Horizontal systematic throughput,Ipsam placeat quod occaecati quod. Inventore ipsum adipisci ab fugit dolor quis rerum.,"None, Keep refrigerated.",9x34x36,74.65,Perishable,False,False,498,290,SUP-002,85.94
PROD-00440,Re-engineered even-keeled middleware,Est totam aut vero perspiciatis ea necessitatibus. Inventore officiis at molestiae.,Standard handling.,73x36x37,177.24,Household,False,False,171,447,SUP-013,3762.52
PROD-00441,Grass-roots neutral protocol,Itaque dolorem saepe minus totam at. Animi magni vitae cupiditate alias. Quam voluptatum nihil hic quibusdam nostrum aut. Nulla distinctio quasi aut.,"None, Keep refrigerated.",62x77x48,46.68,Perishable,False,False,384,439,SUP-018,1205.98
PROD-00442,Compatible system-worthy hierarchy,Rerum tempore quis consequatur laboriosam facilis autem. Atque commodi voluptatibus ad. Possimus dolorum animi tenetur. Sapiente praesentium quis dolorum.,Standard handling.,22x14x40,143.77,Hardware,False,False,424,375,SUP-002,3216.15
PROD-00443,Reactive mission-critical middleware,Sed distinctio veniam amet tempora sapiente nobis. Dignissimos dolore dolorum voluptatibus sit deserunt. In architecto officiis possimus aspernatur.,Standard handling.,57x42x30,36.78,Electronics,False,False,488,600,SUP-002,649.9
PROD-00444,Persevering holistic complexity,Quibusdam ex earum praesentium aut iusto sunt. Quae ad sunt quisquam veritatis.,Standard handling.,52x50x48,140.22,Electronics,False,False,308,852,SUP-002,474.14
PROD-00445,Object-based 5thgeneration functionalities,Possimus quia minima optio repudiandae.,Standard handling.,44x11x47,187.09,Books,False,False,66,907,SUP-004,806.41
PROD-00446,Persevering bifurcated challenge,Labore quas nihil. Est iste fuga itaque distinctio ex.,"None, Keep refrigerated.",80x66x13,24.25,Perishable,False,False,387,379,SUP-002,3578.32
PROD-00447,Horizontal multimedia conglomeration,Corporis veritatis laborum enim repellendus alias culpa.,Standard handling.,98x75x39,17.97,Electronics,False,False,377,587,SUP-016,1682.7
PROD-00448,Synchronized holistic migration,Deserunt voluptas qui architecto fuga accusantium.,Standard handling.,94x47x47,76.04,Clothing,False,False,219,670,SUP-006,3988.92
PROD-00449,Configurable multi-tasking secured line,Culpa tenetur adipisci illum sunt.,"None, Fragile, handle with care.",72x72x43,18.14,Hardware,True,False,81,670,SUP-004,1713.1
PROD-00450,Focused logistical frame,Repudiandae vero harum. Adipisci assumenda suscipit ullam fugiat voluptatum corrupti.,Standard handling.,82x6x21,164.69,Books,False,False,349,816,SUP-011,4796.2
PROD-00451,Decentralized methodical product,Earum eius sequi quo libero sequi.,"None, Hazardous material, consult safety data sheet.",49x17x21,33.51,Electronics,False,True,178,738,SUP-019,423.58
PROD-00452,Configurable zero tolerance analyzer,Quasi soluta accusamus occaecati magnam quis molestiae quas. Assumenda sit ad autem repellat eligendi. Quas quod debitis libero voluptas corporis. Necessitatibus quibusdam similique sint.,Standard handling.,54x61x32,80.65,Books,False,False,257,599,SUP-003,3419.44
PROD-00453,Persevering attitude-oriented data-warehouse,Natus fuga vitae in odit optio iusto repellendus.,Standard handling.,35x50x11,144.75,Electronics,False,False,213,827,SUP-008,1995.89
PROD-00454,Team-oriented attitude-oriented Graphical User Interface,Vero sunt deserunt maiores. Voluptatem pariatur molestiae voluptate dolorem illo. Culpa officiis qui reprehenderit quisquam. A nam laboriosam inventore.,Standard handling.,99x29x37,21.6,Electronics,False,False,414,943,SUP-010,1718.43
PROD-00455,Face-to-face high-level encryption,Distinctio ipsam molestiae tempora culpa facere dicta perferendis. Optio ut culpa.,"None, Fragile, handle with care.",84x63x43,192.45,Electronics,True,False,230,996,SUP-019,2958.14
PROD-00456,Multi-tiered interactive customer loyalty,Nam suscipit quis sequi. Ratione velit fuga tempora ipsum necessitatibus itaque.,Standard handling.,93x45x8,117.26,Clothing,False,False,342,248,SUP-006,4822.35
PROD-00457,Open-source 5thgeneration success,Provident voluptate accusamus. Nam nulla molestiae.,Standard handling.,51x75x14,146.22,Household,False,False,442,463,SUP-009,2475.71
PROD-00458,Total 4thgeneration emulation,Aperiam quidem ea nesciunt mollitia reiciendis iure quod. Voluptate tenetur ex reprehenderit dolorem nesciunt error.,"None, Fragile, handle with care.",64x67x49,134.1,Clothing,True,False,169,662,SUP-004,1693.07
PROD-00459,Realigned 24/7 orchestration,Nisi quia aut impedit deserunt hic pariatur eius. Temporibus excepturi reprehenderit minima dolorum.,Standard handling.,13x60x25,67.46,Hardware,False,False,281,555,SUP-010,1829.82
PROD-00460,Re-engineered secondary application,Vel sequi eligendi.,Standard handling.,45x39x36,146.92,Hardware,False,False,421,994,SUP-004,2192.68
PROD-00461,Streamlined contextually-based time-frame,Nesciunt sunt sed reprehenderit officiis temporibus recusandae laboriosam. Officia ut in non vitae.,Standard handling.,75x58x42,122.1,Hardware,False,False,227,882,SUP-017,560.06
PROD-00462,Visionary multi-state pricing structure,Aspernatur minima ipsam magnam recusandae sed magni odio. Culpa inventore suscipit qui doloremque et. Molestiae accusamus provident deleniti exercitationem quisquam explicabo.,"None, Fragile, handle with care.",55x39x41,165.36,Medical Supplies,True,False,161,745,SUP-005,1742.74
PROD-00463,Persistent reciprocal orchestration,Eveniet maxime debitis iusto ullam itaque. Saepe temporibus animi rerum esse blanditiis.,Standard handling.,9x72x36,171.51,Electronics,False,False,233,817,SUP-003,2195.48
PROD-00464,Managed hybrid productivity,Voluptate praesentium corporis dolores. Cumque in suscipit sequi harum laborum ipsa.,Standard handling.,65x31x35,54.99,Hardware,False,False,409,727,SUP-007,3314.26
PROD-00465,Intuitive regional help-desk,Modi doloribus voluptatibus. Voluptas velit nobis iure. Optio eveniet quas fugiat accusantium modi ea.,Standard handling.,72x37x38,89.67,Clothing,False,False,64,594,SUP-010,371.54
PROD-00466,Inverse systemic time-frame,At pariatur pariatur aut illum eum. Ipsa tempore reprehenderit velit ducimus quod. Soluta eius cum reiciendis assumenda optio mollitia.,"None, Hazardous material, consult safety data sheet.",38x28x31,198.21,Clothing,False,True,339,271,SUP-018,9.66
PROD-00467,Re-contextualized actuating help-desk,Voluptatum aut nihil excepturi atque ut. Necessitatibus voluptas saepe quos delectus voluptas. Amet quibusdam non perspiciatis perspiciatis quisquam.,"None, Hazardous material, consult safety data sheet.",27x40x37,3.61,Hardware,False,True,134,753,SUP-001,4979.42
PROD-00468,Optimized responsive encoding,Exercitationem vero sunt deleniti minima omnis hic. Debitis architecto sint quam autem. Consectetur repudiandae porro ex repellendus.,Standard handling.,76x15x23,162.48,Electronics,False,False,198,415,SUP-002,1385.22
PROD-00469,Front-line solution-oriented flexibility,Quae repellat modi praesentium. Consequuntur cupiditate exercitationem aliquam velit. Culpa aut ducimus deserunt eaque. Recusandae nisi quo ipsam dolorem temporibus vel.,"None, Hazardous material, consult safety data sheet.",81x11x28,50.22,Electronics,False,True,247,850,SUP-013,36.59
PROD-00470,Visionary executive concept,Commodi maxime laborum nesciunt provident commodi sequi aperiam. Sapiente placeat aliquam dolores. Nobis ducimus delectus voluptas.,"None, Keep refrigerated.",53x46x18,104.52,Perishable,False,False,222,142,SUP-002,2086.7
PROD-00471,Organized non-volatile capacity,Eos temporibus assumenda dolor eaque quidem. Aperiam pariatur libero blanditiis molestiae similique.,Standard handling.,8x53x25,19.67,Electronics,False,False,494,660,SUP-004,375.63
PROD-00472,Focused didactic task-force,Eos ullam laborum deleniti.,Standard handling.,66x65x11,54.21,Household,False,False,62,602,SUP-006,1852.64
PROD-00473,Fundamental multi-state conglomeration,Fugiat ut eum eligendi eum atque earum. Nobis error harum autem quos dolorum amet.,"None, Fragile, handle with care.",68x27x14,47.52,Hardware,True,False,182,943,SUP-009,4391.96
PROD-00474,Multi-lateral global protocol,Nisi explicabo corrupti quis quam. In excepturi minus magnam ea excepturi fuga. Cum minus laudantium magni error quos.,Standard handling.,49x73x34,154.62,Household,False,False,255,163,SUP-012,3738.78
PROD-00475,Customizable intangible parallelism,Aliquam laboriosam minima autem. Dolor recusandae repellat.,Standard handling.,41x60x39,43.25,Clothing,False,False,63,928,SUP-014,1047.25
PROD-00476,De-engineered impactful functionalities,Eos animi ullam dolorum nostrum asperiores est. Quod suscipit totam incidunt voluptates.,Standard handling.,73x47x36,67.78,Electronics,False,False,395,113,SUP-013,3129.08
PROD-00477,Public-key solution-oriented task-force,Quasi ut quia corrupti vitae.,"None, Fragile, handle with care.",73x14x50,29.31,Hardware,True,False,79,603,SUP-014,1773.59
PROD-00478,Streamlined local solution,Vero excepturi rem tenetur aut architecto dolore libero. Odit eveniet quae ex debitis.,Standard handling.,100x19x39,77.42,Clothing,False,False,451,677,SUP-018,1092.04
PROD-00479,Customer-focused asynchronous architecture,Tenetur occaecati fugit esse. Dolorem unde ipsam animi velit tempora.,Standard handling.,6x8x28,50.45,Hardware,False,False,234,888,SUP-004,197.49
PROD-00480,Inverse intangible middleware,Voluptatem quasi aliquid voluptatibus laboriosam maxime consequatur. At assumenda ipsam blanditiis deleniti repudiandae provident cumque. Quibusdam cumque dolorem facilis dolore temporibus.,"None, Keep refrigerated.",30x53x29,119.9,Perishable,False,False,313,132,SUP-013,913.2
PROD-00481,Secured exuding service-desk,Eum vero aliquam dicta ullam. Facilis officia porro quis accusamus qui. Odio similique accusantium ab.,Standard handling.,45x35x5,50.19,Household,False,False,132,636,SUP-002,2649.94
PROD-00482,Universal didactic architecture,Enim pariatur quasi repellendus ipsum ipsa. Sit nemo culpa natus neque.,Standard handling.,16x61x31,194.58,Household,False,False,455,662,SUP-007,579.48
PROD-00483,Business-focused web-enabled portal,A molestias mollitia occaecati. Culpa libero consectetur architecto est culpa molestiae cupiditate. Sit odit facilis aliquid placeat ipsa voluptate. Rerum eveniet consequuntur dolore nihil illo.,Standard handling.,38x49x49,17.86,Household,False,False,308,316,SUP-008,2462.73
PROD-00484,Grass-roots 24/7 strategy,Quidem minus quod perspiciatis dolor odio cumque. Possimus consequuntur facilis commodi. Blanditiis cum vel necessitatibus unde accusantium veritatis.,Standard handling.,13x48x27,198.83,Clothing,False,False,132,400,SUP-017,2956.6
PROD-00485,Ameliorated modular product,Sapiente tenetur aliquid odio. Dignissimos amet tempore sint. Repellendus ullam reiciendis perspiciatis.,Standard handling.,63x31x17,30.07,Clothing,False,False,411,577,SUP-013,1254.97
PROD-00486,Streamlined global customer loyalty,Rem ducimus illum non. Similique molestias at provident ut nam. Veniam doloremque eaque.,Standard handling.,7x69x40,94.69,Medical Supplies,False,False,272,104,SUP-014,4482.13
PROD-00487,Organic reciprocal moratorium,Perferendis odit sed quia sit perspiciatis. Vitae nam enim natus laudantium. Occaecati incidunt consequatur quas reprehenderit exercitationem.,Standard handling.,19x52x30,65.43,Clothing,False,False,483,364,SUP-004,2577.46
PROD-00488,Assimilated bifurcated database,Voluptatibus numquam ea repellendus soluta. Optio voluptas iusto. Aliquid accusamus velit minus.,"None, Fragile, handle with care.",35x25x19,166.27,Hardware,True,False,111,619,SUP-003,2045.67
PROD-00489,User-friendly mobile leverage,Nemo culpa consectetur non rerum suscipit quas. Magni temporibus illum velit rerum repellendus. Atque temporibus libero sapiente.,"None, Fragile, handle with care.",100x76x48,9.85,Household,True,False,288,397,SUP-003,2014.16
PROD-00490,Implemented dynamic middleware,Exercitationem voluptate quam modi ipsam qui aperiam.,"None, Fragile, handle with care.",100x65x10,5.48,Books,True,False,456,860,SUP-003,1833.29
PROD-00491,Reactive logistical initiative,Nulla animi nobis maiores. Possimus veritatis temporibus officiis.,"None, Fragile, handle with care.",74x16x7,61.86,Medical Supplies,True,False,189,316,SUP-003,808.14
PROD-00492,De-engineered content-based help-desk,Eos iure omnis quis rerum. Debitis quisquam in quos alias.,"None, Keep refrigerated.",100x44x36,113.3,Perishable,False,False,65,482,SUP-015,1268.37
PROD-00493,Customizable coherent capacity,Amet dolore qui. Sunt expedita non.,"None, Fragile, handle with care.",67x66x15,6.59,Electronics,True,False,433,230,SUP-011,4964.48
PROD-00494,Object-based 24hour capacity,Iure voluptatum deserunt in minus. Alias labore quas amet nemo veniam.,Standard handling.,65x34x23,15.18,Electronics,False,False,264,744,SUP-019,2509.09
PROD-00495,Progressive analyzing circuit,Ipsa eligendi eum doloribus consectetur. Quod omnis est. Dolorem dolorum corporis consectetur beatae veritatis eveniet.,"None, Keep refrigerated.",45x29x25,24.86,Perishable,False,False,200,813,SUP-009,18.48
PROD-00496,Fundamental foreground analyzer,Asperiores qui ipsum aut ducimus necessitatibus. Dolores pariatur dolore distinctio fugit tempora.,Standard handling.,85x40x38,127.37,Books,False,False,446,556,SUP-006,914.15
PROD-00497,Virtual systemic array,Molestias esse illum. Aspernatur eveniet eos blanditiis eos quae tenetur voluptatibus. Nesciunt veritatis animi vel nostrum ut consequatur.,"None, Fragile, handle with care.",74x5x43,130.22,Books,True,False,187,873,SUP-006,4926.18
PROD-00498,Triple-buffered disintermediate protocol,Explicabo excepturi possimus nisi ut et sit ducimus. Eos quam tenetur eum. Ducimus sunt cupiditate officia excepturi necessitatibus nostrum temporibus.,"None, Fragile, handle with care.",55x56x41,181.76,Electronics,True,False,98,132,SUP-013,4561.98
PROD-00499,Optimized responsive knowledge user,Ea eaque eligendi eius dicta odit. Perferendis iste earum porro assumenda.,Standard handling.,8x74x15,11.95,Medical Supplies,False,False,264,550,SUP-020,3590.85
PROD-00500,Expanded responsive product,Nostrum expedita nisi soluta optio quia quia. Ipsum earum ipsa beatae. Neque rerum non cum inventore quae hic.,Standard handling.,70x35x11,124.4,Medical Supplies,False,False,177,278,SUP-018,2256.12
PROD-00501,Upgradable interactive function,Praesentium quasi doloremque dolores reiciendis. Quia doloribus assumenda esse. Debitis explicabo placeat maiores aliquam vitae. Totam illo pariatur a.,"None, Fragile, handle with care.",22x5x30,89.64,Hardware,True,False,192,456,SUP-003,4268.14
PROD-00502,Multi-tiered neutral knowledge user,Iure ullam aliquid natus ducimus voluptatem. Nisi natus nemo dolore. Tempora explicabo exercitationem nisi quibusdam dolorum nulla.,"None, Fragile, handle with care.",21x66x8,25.98,Books,True,False,185,762,SUP-020,3932.23
PROD-00503,Programmable neutral initiative,Quo magni ad deserunt. Distinctio quia quasi iste.,"None, Fragile, handle with care.",90x17x15,158.69,Books,True,False,397,912,SUP-015,3606.68
PROD-00504,Enhanced responsive hub,Natus labore error. Recusandae non unde rem dolore nesciunt vel. Et quidem vitae.,Standard handling.,82x43x49,117.75,Hardware,False,False,301,749,SUP-020,1626.22
PROD-00505,Function-based asynchronous concept,Qui soluta dolores. Distinctio sequi beatae quisquam excepturi ipsa ratione delectus.,Standard handling.,40x80x36,65.8,Household,False,False,321,882,SUP-010,3502.1
PROD-00506,Future-proofed incremental algorithm,Mollitia nemo doloribus rem optio. Porro repellat sed magnam eos sapiente officia. Ab occaecati corrupti quis.,Standard handling.,62x30x43,174.4,Clothing,False,False,335,758,SUP-007,4500.21
PROD-00507,Proactive transitional customer loyalty,Laborum tempora ullam illo. Adipisci earum necessitatibus nesciunt cupiditate. Asperiores mollitia ducimus eveniet delectus eius.,Standard handling.,45x50x17,80.46,Clothing,False,False,291,206,SUP-007,2178.48
PROD-00508,Seamless mobile throughput,Expedita veritatis veritatis tempora nulla facilis ut. Repellat voluptatem tempora repellendus voluptate. Facilis commodi placeat praesentium dignissimos ea vero.,Standard handling.,74x11x45,12.64,Hardware,False,False,490,913,SUP-017,4523.17
PROD-00509,Programmable maximized function,Neque est libero eveniet quae eaque unde exercitationem. Unde pariatur commodi quidem autem. Id ipsum ipsa accusantium.,Standard handling.,47x19x36,20.3,Electronics,False,False,311,735,SUP-001,887.56
PROD-00510,Right-sized modular protocol,At doloribus occaecati eaque culpa corporis. Facere sunt impedit nisi cupiditate sint saepe.,Standard handling.,17x26x48,115.62,Household,False,False,385,999,SUP-004,3271.0
PROD-00511,Intuitive responsive neural-net,A minima voluptate natus animi vel illum. Sunt nesciunt dicta quisquam. Dicta saepe doloremque aut harum.,Standard handling.,97x21x19,195.32,Medical Supplies,False,False,259,388,SUP-014,4732.43
PROD-00512,Grass-roots national adapter,Consequatur similique quia dolores doloremque culpa. Possimus possimus ab fuga libero. Corporis molestiae suscipit repellendus nesciunt atque.,Standard handling.,38x54x17,50.25,Medical Supplies,False,False,189,337,SUP-004,4112.4
PROD-00513,Synergized foreground firmware,Architecto cumque nemo vitae velit corrupti enim. At voluptatum quaerat laudantium. Ex laudantium eum vel expedita quas.,Standard handling.,96x31x37,37.76,Electronics,False,False,310,281,SUP-018,3868.09
PROD-00514,Synergistic tertiary access,Quibusdam quasi omnis architecto. Itaque eveniet quos repellat nam quis dignissimos facilis. Ea voluptate exercitationem aliquid minima.,"None, Keep refrigerated.",40x77x44,94.53,Perishable,False,False,287,626,SUP-005,1956.15
PROD-00515,Optional national encryption,Cumque repellendus consectetur optio fugit. Maiores ad officiis omnis id temporibus. Esse cupiditate voluptate veniam tempore dolorum.,Standard handling.,84x41x12,45.41,Electronics,False,False,184,326,SUP-002,169.18
PROD-00516,Up-sized maximized approach,Saepe earum ipsa. Odit quidem ut tenetur.,Standard handling.,89x63x13,56.34,Electronics,False,False,403,710,SUP-020,3008.15
PROD-00517,Organic bandwidth-monitored workforce,Suscipit neque occaecati fugiat perspiciatis exercitationem commodi. Perferendis et deleniti saepe.,Standard handling.,21x50x43,184.37,Books,False,False,254,930,SUP-013,4134.14
PROD-00518,Virtual full-range middleware,Corporis debitis amet aliquid quasi. Similique eaque perspiciatis ut.,"None, Fragile, handle with care.",17x22x24,151.35,Electronics,True,False,365,426,SUP-013,1155.46
PROD-00519,Monitored modular initiative,Et quam saepe dolor sunt. Nesciunt ullam provident ullam hic aliquid. Recusandae sunt eligendi autem impedit natus.,Standard handling.,96x21x27,65.31,Clothing,False,False,374,936,SUP-005,2246.8
PROD-00520,Front-line multi-state throughput,Eveniet numquam quo ut sit id aperiam. Deserunt dolor occaecati accusamus vitae nisi minima.,"None, Fragile, handle with care., Keep refrigerated.",27x71x13,128.88,Perishable,True,False,118,774,SUP-002,4476.57
PROD-00521,Team-oriented full-range hierarchy,Corporis eum earum inventore. Dicta occaecati perferendis commodi totam vero voluptatibus. Libero rerum non unde.,Standard handling.,68x75x18,104.04,Books,False,False,230,472,SUP-007,4094.97
PROD-00522,Future-proofed object-oriented protocol,Reiciendis eum laborum vero. Nam nemo dolores ducimus vel totam deserunt.,Standard handling.,15x64x40,149.4,Electronics,False,False,112,547,SUP-018,2526.92
PROD-00523,Reverse-engineered grid-enabled time-frame,Fuga mollitia repellat atque ea voluptate illo. Aperiam reprehenderit veniam.,Standard handling.,39x58x21,88.88,Hardware,False,False,294,504,SUP-002,4650.08
PROD-00524,Ameliorated 5thgeneration core,Esse iusto fugiat tempore. Neque laborum inventore provident tenetur deserunt. Tenetur magni quasi illo.,Standard handling.,64x72x23,168.14,Books,False,False,396,696,SUP-014,732.98
PROD-00525,Switchable multi-state productivity,Aspernatur dolores modi pariatur. Fugiat porro voluptatem consequuntur pariatur dolor. Id amet suscipit porro ad ex architecto porro. Ratione sunt laborum placeat.,Standard handling.,20x6x12,62.3,Medical Supplies,False,False,98,561,SUP-013,3025.14
PROD-00526,Object-based cohesive forecast,Deleniti optio eos dolor vero. Temporibus vel cum cum nemo excepturi debitis. Excepturi nemo aspernatur quo veritatis quam.,"None, Fragile, handle with care., Keep refrigerated.",87x33x39,161.67,Perishable,True,False,493,609,SUP-007,2360.13
PROD-00527,Multi-channeled heuristic paradigm,Alias ad illum sint. Possimus doloremque quasi.,Standard handling.,63x27x50,15.15,Hardware,False,False,434,268,SUP-015,1692.01
PROD-00528,Adaptive modular definition,Magni ex quidem maiores alias maiores ullam.,Standard handling.,72x25x8,20.67,Medical Supplies,False,False,157,311,SUP-008,1860.81
PROD-00529,Business-focused didactic methodology,Veniam rem libero doloribus. Accusamus autem a natus nemo impedit. Ut fugiat libero ipsum veritatis ea odit.,"None, Fragile, handle with care.",99x78x43,62.71,Books,True,False,305,754,SUP-009,656.23
PROD-00530,Up-sized 3rdgeneration process improvement,Recusandae aspernatur ad saepe aperiam. Vitae esse laudantium facilis nemo modi nobis.,"None, Hazardous material, consult safety data sheet.",8x33x41,2.26,Medical Supplies,False,True,71,668,SUP-004,3720.64
PROD-00531,Triple-buffered fresh-thinking middleware,Veniam explicabo placeat nisi sint maiores neque. Sit recusandae distinctio cupiditate odio molestias hic provident. Quos expedita mollitia hic doloribus excepturi adipisci.,"None, Fragile, handle with care.",17x77x43,67.31,Clothing,True,False,165,305,SUP-011,492.36
PROD-00532,Configurable multi-tasking matrices,Exercitationem sequi ratione vel. Fuga quasi fugit.,"None, Keep refrigerated.",65x66x8,127.79,Perishable,False,False,341,581,SUP-006,3586.42
PROD-00533,Open-architected logistical Graphic Interface,Sapiente inventore rem sequi dicta minima. Facilis recusandae et quaerat minima fugit voluptatum. Molestiae accusantium molestiae quibusdam labore cupiditate est ipsum.,Standard handling.,19x20x35,116.28,Clothing,False,False,411,944,SUP-007,3204.98
PROD-00534,Total clear-thinking flexibility,Doloribus libero autem perspiciatis tenetur mollitia. Ratione soluta magnam eaque ratione.,Standard handling.,55x36x28,148.79,Books,False,False,245,964,SUP-004,4862.95
PROD-00535,Total responsive success,Iure et a corporis ab. Unde est illum sapiente labore vel. Voluptate quo veritatis fuga occaecati hic. Ratione autem rem harum adipisci minima.,Standard handling.,74x36x32,67.27,Household,False,False,283,742,SUP-009,3134.82
PROD-00536,Persistent zero-defect project,Quibusdam doloribus rem laboriosam perferendis molestias eos aperiam. Accusamus consequatur doloribus. Ipsum impedit voluptates enim eaque.,Standard handling.,58x55x22,18.73,Household,False,False,436,515,SUP-001,2483.38
PROD-00537,Synergized web-enabled circuit,Vel nemo excepturi ut excepturi voluptatum.,"None, Fragile, handle with care.",81x25x5,101.75,Electronics,True,False,196,932,SUP-005,616.24
PROD-00538,Synchronized multimedia analyzer,Accusamus voluptatum optio temporibus voluptates possimus. Tempore molestias voluptates reiciendis in voluptatem possimus. Ipsa id maxime assumenda enim iste ducimus sit. Eveniet minima aut recusandae inventore qui.,"None, Fragile, handle with care.",30x48x10,150.42,Books,True,False,124,696,SUP-017,4913.37
PROD-00539,Synchronized reciprocal superstructure,Voluptate corrupti amet nostrum quibusdam neque doloremque.,Standard handling.,54x11x49,179.6,Books,False,False,314,768,SUP-014,523.76
PROD-00540,Sharable bandwidth-monitored data-warehouse,Illum nemo quae quisquam quisquam laboriosam. Temporibus placeat consequuntur rerum nobis laborum.,"None, Fragile, handle with care.",21x14x9,142.56,Clothing,True,False,217,894,SUP-018,602.22
PROD-00541,Re-engineered radical focus group,Officia accusantium debitis laboriosam sed. Quibusdam qui ut libero quisquam ut. Id repellendus asperiores cupiditate.,"None, Keep refrigerated.",93x41x39,154.56,Perishable,False,False,313,808,SUP-014,653.67
PROD-00542,Persistent scalable Graphical User Interface,Rerum fugit animi quia cum assumenda cumque rem. Atque iste labore aliquam eum qui quos adipisci.,"None, Fragile, handle with care.",31x51x16,61.0,Household,True,False,274,862,SUP-017,1443.33
PROD-00543,Secured client-server moratorium,Culpa eligendi provident molestiae. Commodi cupiditate voluptas nisi corrupti harum dolorem nesciunt.,Standard handling.,95x35x37,26.02,Clothing,False,False,407,580,SUP-009,4675.66
